Movie Name,Release Year,Duration,IMDB Rating,Metascore,Votes,Genre,Director,Cast,Gross,Overview
Days of Thunder,1990,107,6.1,60.0,96070,"Action, Drama, Sport",Tony Scott,Tom Cruise,82.67,"Days of Thunder (1990) is a Action, Drama, Sport film directed by Tony Scott starring Tom Cruise. Rated 6.1 on IMDB."
Tenkuu no Shiro Laputa,1986,125,8.0,78.0,181444,"Animation, Adventure, Family",Hayao Miyazaki,Mayumi Tanaka,44.82,"Tenkuu no Shiro Laputa (1986) is a Animation, Adventure, Family film directed by Hayao Miyazaki starring Mayumi Tanaka. Rated 8.0 on IMDB."
The Fisher King,1991,137,7.5,67.0,90630,"Comedy, Drama, Fantasy",Terry Gilliam,Jeff Bridges,41.9,"The Fisher King (1991) is a Comedy, Drama, Fantasy film directed by Terry Gilliam starring Jeff Bridges. Rated 7.5 on IMDB."
Young Guns,1988,107,6.8,50.0,67694,"Action, Drama, Western",Christopher Cain,Emilio Estevez,45.66,"Young Guns (1988) is a Action, Drama, Western film directed by Christopher Cain starring Emilio Estevez. Rated 6.8 on IMDB."
My Cousin Vinny,1992,120,7.6,68.0,139691,"Comedy, Crime",Jonathan Lynn,Joe Pesci,52.93,"My Cousin Vinny (1992) is a Comedy, Crime film directed by Jonathan Lynn starring Joe Pesci. Rated 7.6 on IMDB."
Dead Calm,1989,96,6.8,70.0,43542,"Horror, Thriller",Phillip Noyce,Nicole Kidman,7.83,"Dead Calm (1989) is a Horror, Thriller film directed by Phillip Noyce starring Nicole Kidman. Rated 6.8 on IMDB."
Kindergarten Cop,1990,111,6.2,61.0,161880,"Action, Comedy, Crime",Ivan Reitman,Arnold Schwarzenegger,91.46,"Kindergarten Cop (1990) is a Action, Comedy, Crime film directed by Ivan Reitman starring Arnold Schwarzenegger. Rated 6.2 on IMDB."
Dick Tracy,1990,105,6.2,68.0,65550,"Action, Comedy, Crime",Warren Beatty,Warren Beatty,103.74,"Dick Tracy (1990) is a Action, Comedy, Crime film directed by Warren Beatty starring Warren Beatty. Rated 6.2 on IMDB."
Beethoven,1992,87,5.7,61.0,76238,"Comedy, Drama, Family",Brian Levant,Charles Grodin,57.11,"Beethoven (1992) is a Comedy, Drama, Family film directed by Brian Levant starring Charles Grodin. Rated 5.7 on IMDB."
Labyrinth,1986,101,7.3,50.0,149016,"Adventure, Family, Fantasy",Jim Henson,David Bowie,12.73,"Labyrinth (1986) is a Adventure, Family, Fantasy film directed by Jim Henson starring David Bowie. Rated 7.3 on IMDB."
A Christmas Story,1983,93,7.9,77.0,168430,"Comedy, Family",Bob Clark,Peter Billingsley,20.61,"A Christmas Story (1983) is a Comedy, Family film directed by Bob Clark starring Peter Billingsley. Rated 7.9 on IMDB."
Fast Times at Ridgemont High,1982,90,7.1,61.0,115280,"Comedy, Drama",Amy Heckerling,Sean Penn,27.09,"Fast Times at Ridgemont High (1982) is a Comedy, Drama film directed by Amy Heckerling starring Sean Penn. Rated 7.1 on IMDB."
Teenage Mutant Ninja Turtles,1990,93,6.8,51.0,104440,"Action, Adventure, Comedy",Steve Barron,Judith Hoag,135.27,"Teenage Mutant Ninja Turtles (1990) is a Action, Adventure, Comedy film directed by Steve Barron starring Judith Hoag. Rated 6.8 on IMDB."
Lord of the Flies,1990,90,6.4,49.0,33469,"Adventure, Drama, Thriller",Harry Hook,Balthazar Getty,13.99,"Lord of the Flies (1990) is a Adventure, Drama, Thriller film directed by Harry Hook starring Balthazar Getty. Rated 6.4 on IMDB."
Cry-Baby,1990,85,6.5,63.0,64609,"Comedy, Musical",John Waters,Johnny Depp,8.27,"Cry-Baby (1990) is a Comedy, Musical film directed by John Waters starring Johnny Depp. Rated 6.5 on IMDB."
Tales from the Darkside: The Movie,1990,93,6.2,54.0,19281,"Comedy, Fantasy, Horror",John Harrison,Debbie Harry,16.32,"Tales from the Darkside: The Movie (1990) is a Comedy, Fantasy, Horror film directed by John Harrison starring Debbie Harry. Rated 6.2 on IMDB."
Lionheart,1990,108,6.2,41.0,39616,"Action, Crime, Drama",Sheldon Lettich,Jean-Claude Van Damme,24.08,"Lionheart (1990) is a Action, Crime, Drama film directed by Sheldon Lettich starring Jean-Claude Van Damme. Rated 6.2 on IMDB."
The Witches,1990,91,6.8,78.0,54467,"Adventure, Comedy, Family",Nicolas Roeg,Anjelica Huston,10.36,"The Witches (1990) is a Adventure, Comedy, Family film directed by Nicolas Roeg starring Anjelica Huston. Rated 6.8 on IMDB."
Mermaids,1990,110,6.7,56.0,35700,"Comedy, Drama, Romance",Richard Benjamin,Cher,35.42,"Mermaids (1990) is a Comedy, Drama, Romance film directed by Richard Benjamin starring Cher. Rated 6.7 on IMDB."
Flatliners,1990,115,6.5,55.0,93068,"Drama, Horror, Sci-Fi",Joel Schumacher,Kiefer Sutherland,61.49,"Flatliners (1990) is a Drama, Horror, Sci-Fi film directed by Joel Schumacher starring Kiefer Sutherland. Rated 6.5 on IMDB."
Internal Affairs,1990,115,6.5,63.0,22474,"Crime, Drama, Thriller",Mike Figgis,Richard Gere,27.73,"Internal Affairs (1990) is a Crime, Drama, Thriller film directed by Mike Figgis starring Richard Gere. Rated 6.5 on IMDB."
Air America,1990,113,5.8,33.0,30417,"Action, Comedy, War",Roger Spottiswoode,Mel Gibson,31.05,"Air America (1990) is a Action, Comedy, War film directed by Roger Spottiswoode starring Mel Gibson. Rated 5.8 on IMDB."
Big Trouble in Little China,1986,99,7.2,53.0,153166,"Action, Adventure, Comedy",John Carpenter,Kurt Russell,11.1,"Big Trouble in Little China (1986) is a Action, Adventure, Comedy film directed by John Carpenter starring Kurt Russell. Rated 7.2 on IMDB."
Never Say Never Again,1983,134,6.1,68.0,72909,"Action, Adventure, Thriller",Irvin Kershner,Sean Connery,55.5,"Never Say Never Again (1983) is a Action, Adventure, Thriller film directed by Irvin Kershner starring Sean Connery. Rated 6.1 on IMDB."
Kickboxer,1989,97,6.4,33.0,60626,"Action, Sport, Thriller",Mark DiSalle,David Worth,14.7,"Kickboxer (1989) is a Action, Sport, Thriller film directed by Mark DiSalle starring David Worth. Rated 6.4 on IMDB."
Spies Like Us,1985,102,6.4,22.0,52821,"Adventure, Comedy",John Landis,Chevy Chase,60.09,"Spies Like Us (1985) is a Adventure, Comedy film directed by John Landis starring Chevy Chase. Rated 6.4 on IMDB."
The Dead Zone,1983,103,7.2,69.0,76952,"Drama, Horror, Sci-Fi",David Cronenberg,Christopher Walken,20.77,"The Dead Zone (1983) is a Drama, Horror, Sci-Fi film directed by David Cronenberg starring Christopher Walken. Rated 7.2 on IMDB."
A Room with a View,1985,117,7.2,83.0,47658,"Drama, Romance",James Ivory,Maggie Smith,20.97,"A Room with a View (1985) is a Drama, Romance film directed by James Ivory starring Maggie Smith. Rated 7.2 on IMDB."
Road House,1989,114,6.7,36.0,91904,"Action, Thriller",Rowdy Herrington,Patrick Swayze,30.05,"Road House (1989) is a Action, Thriller film directed by Rowdy Herrington starring Patrick Swayze. Rated 6.7 on IMDB."
Tron,1982,96,6.7,58.0,128904,"Action, Adventure, Sci-Fi",Steven Lisberger,Jeff Bridges,33.0,"Tron (1982) is a Action, Adventure, Sci-Fi film directed by Steven Lisberger starring Jeff Bridges. Rated 6.7 on IMDB."
Willow,1988,126,7.2,47.0,129540,"Action, Adventure, Drama",Ron Howard,Val Kilmer,57.27,"Willow (1988) is a Action, Adventure, Drama film directed by Ron Howard starring Val Kilmer. Rated 7.2 on IMDB."
Clue,1985,94,7.2,41.0,108695,"Comedy, Crime, Mystery",Jonathan Lynn,Eileen Brennan,14.64,"Clue (1985) is a Comedy, Crime, Mystery film directed by Jonathan Lynn starring Eileen Brennan. Rated 7.2 on IMDB."
Revenge of the Nerds,1984,90,6.6,44.0,58203,Comedy,Jeff Kanew,Robert Carradine,40.9,Revenge of the Nerds (1984) is a Comedy film directed by Jeff Kanew starring Robert Carradine. Rated 6.6 on IMDB.
The 'Burbs,1989,102,6.8,45.0,83070,"Comedy, Mystery, Thriller",Joe Dante,Tom Hanks,36.6,"The 'Burbs (1989) is a Comedy, Mystery, Thriller film directed by Joe Dante starring Tom Hanks. Rated 6.8 on IMDB."
Major League,1989,107,7.2,62.0,75934,"Comedy, Sport",David S. Ward,Tom Berenger,49.8,"Major League (1989) is a Comedy, Sport film directed by David S. Ward starring Tom Berenger. Rated 7.2 on IMDB."
Silverado,1985,133,7.2,64.0,49094,"Action, Crime, Drama",Lawrence Kasdan,Kevin Kline,33.2,"Silverado (1985) is a Action, Crime, Drama film directed by Lawrence Kasdan starring Kevin Kline. Rated 7.2 on IMDB."
Tremors,1990,96,7.2,65.0,149591,"Comedy, Horror",Ron Underwood,Kevin Bacon,16.67,"Tremors (1990) is a Comedy, Horror film directed by Ron Underwood starring Kevin Bacon. Rated 7.2 on IMDB."
The Land Before Time,1988,69,7.4,66.0,98163,"Animation, Adventure, Drama",Don Bluth,Pat Hingle,48.09,"The Land Before Time (1988) is a Animation, Adventure, Drama film directed by Don Bluth starring Pat Hingle. Rated 7.4 on IMDB."
Bottle Rocket,1996,91,6.9,67.0,83314,"Comedy, Crime, Drama",Wes Anderson,Luke Wilson,0.56,"Bottle Rocket (1996) is a Comedy, Crime, Drama film directed by Wes Anderson starring Luke Wilson. Rated 6.9 on IMDB."
Clueless,1995,97,6.9,71.0,244507,"Comedy, Romance",Amy Heckerling,Alicia Silverstone,56.63,"Clueless (1995) is a Comedy, Romance film directed by Amy Heckerling starring Alicia Silverstone. Rated 6.9 on IMDB."
Heat,1995,170,8.3,76.0,716145,"Action, Crime, Drama",Michael Mann,Al Pacino,67.44,"Heat (1995) is a Action, Crime, Drama film directed by Michael Mann starring Al Pacino. Rated 8.3 on IMDB."
Batman Forever,1995,121,5.4,54.0,265851,"Action, Adventure",Joel Schumacher,Val Kilmer,184.03,"Batman Forever (1995) is a Action, Adventure film directed by Joel Schumacher starring Val Kilmer. Rated 5.4 on IMDB."
Mission: Impossible,1996,110,7.2,59.0,468782,"Action, Adventure, Thriller",Brian De Palma,Tom Cruise,180.98,"Mission: Impossible (1996) is a Action, Adventure, Thriller film directed by Brian De Palma starring Tom Cruise. Rated 7.2 on IMDB."
Groundhog Day,1993,101,8.0,72.0,682322,"Comedy, Drama, Fantasy",Harold Ramis,Bill Murray,70.91,"Groundhog Day (1993) is a Comedy, Drama, Fantasy film directed by Harold Ramis starring Bill Murray. Rated 8.0 on IMDB."
The Shawshank Redemption,1994,142,9.3,82.0,2875249,Drama,Frank Darabont,Tim Robbins,28.34,The Shawshank Redemption (1994) is a Drama film directed by Frank Darabont starring Tim Robbins. Rated 9.3 on IMDB.
Contact,1997,150,7.5,62.0,292202,"Drama, Mystery, Sci-Fi",Robert Zemeckis,Jodie Foster,100.92,"Contact (1997) is a Drama, Mystery, Sci-Fi film directed by Robert Zemeckis starring Jodie Foster. Rated 7.5 on IMDB."
Speed,1994,116,7.3,78.0,390316,"Action, Adventure, Thriller",Jan de Bont,Keanu Reeves,121.25,"Speed (1994) is a Action, Adventure, Thriller film directed by Jan de Bont starring Keanu Reeves. Rated 7.3 on IMDB."
Leaving Las Vegas,1995,111,7.5,82.0,134109,"Drama, Romance",Mike Figgis,Nicolas Cage,32.03,"Leaving Las Vegas (1995) is a Drama, Romance film directed by Mike Figgis starring Nicolas Cage. Rated 7.5 on IMDB."
Apollo 13,I 1995,140,7.7,78.0,314371,"Adventure, Drama, History",Ron Howard,Tom Hanks,173.84,"Apollo 13 (I 1995) is a Adventure, Drama, History film directed by Ron Howard starring Tom Hanks. Rated 7.7 on IMDB."
Titanic,1997,194,7.9,75.0,1275085,"Drama, Romance",James Cameron,Leonardo DiCaprio,659.33,"Titanic (1997) is a Drama, Romance film directed by James Cameron starring Leonardo DiCaprio. Rated 7.9 on IMDB."
Fargo,1996,98,8.1,88.0,723780,"Crime, Thriller",Joel Coen,Ethan Coen,24.61,"Fargo (1996) is a Crime, Thriller film directed by Joel Coen starring Ethan Coen. Rated 8.1 on IMDB."
Schindler's List,1993,195,9.0,95.0,1444171,"Biography, Drama, History",Steven Spielberg,Liam Neeson,96.9,"Schindler's List (1993) is a Biography, Drama, History film directed by Steven Spielberg starring Liam Neeson. Rated 9.0 on IMDB."
Le Cinquième Élément,1997,126,7.6,52.0,504100,"Action, Adventure, Sci-Fi",Luc Besson,Bruce Willis,63.54,"Le Cinquième Élément (1997) is a Action, Adventure, Sci-Fi film directed by Luc Besson starring Bruce Willis. Rated 7.6 on IMDB."
Léon,1994,110,8.5,64.0,1240340,"Action, Crime, Drama",Luc Besson,Jean Reno,19.5,"Léon (1994) is a Action, Crime, Drama film directed by Luc Besson starring Jean Reno. Rated 8.5 on IMDB."
The Lion King,1994,88,8.5,88.0,1137192,"Animation, Adventure, Drama",Roger Allers,Rob Minkoff,422.78,"The Lion King (1994) is a Animation, Adventure, Drama film directed by Roger Allers starring Rob Minkoff. Rated 8.5 on IMDB."
Die Hard with a Vengeance,1995,128,7.6,58.0,407136,"Action, Adventure, Thriller",John McTiernan,Bruce Willis,100.01,"Die Hard with a Vengeance (1995) is a Action, Adventure, Thriller film directed by John McTiernan starring Bruce Willis. Rated 7.6 on IMDB."
Face/Off,1997,138,7.3,82.0,399629,"Action, Crime, Sci-Fi",John Woo,John Travolta,112.23,"Face/Off (1997) is a Action, Crime, Sci-Fi film directed by John Woo starring John Travolta. Rated 7.3 on IMDB."
L.A. Confidential,1997,138,8.2,91.0,615632,"Crime, Drama, Mystery",Curtis Hanson,Kevin Spacey,64.62,"L.A. Confidential (1997) is a Crime, Drama, Mystery film directed by Curtis Hanson starring Kevin Spacey. Rated 8.2 on IMDB."
Primal Fear,1996,129,7.7,47.0,245653,"Crime, Drama, Mystery",Gregory Hoblit,Richard Gere,56.12,"Primal Fear (1996) is a Crime, Drama, Mystery film directed by Gregory Hoblit starring Richard Gere. Rated 7.7 on IMDB."
Casino,1995,178,8.2,73.0,561434,"Crime, Drama",Martin Scorsese,Robert De Niro,42.44,"Casino (1995) is a Crime, Drama film directed by Martin Scorsese starring Robert De Niro. Rated 8.2 on IMDB."
Anastasia,1997,94,7.1,61.0,135492,"Animation, Adventure, Drama",Don Bluth,Gary Goldman,58.41,"Anastasia (1997) is a Animation, Adventure, Drama film directed by Don Bluth starring Gary Goldman. Rated 7.1 on IMDB."
Sleepless in Seattle,1993,105,6.8,72.0,190198,"Comedy, Drama, Romance",Nora Ephron,Tom Hanks,126.53,"Sleepless in Seattle (1993) is a Comedy, Drama, Romance film directed by Nora Ephron starring Tom Hanks. Rated 6.8 on IMDB."
Maverick,1994,127,7.0,62.0,118662,"Action, Adventure, Comedy",Richard Donner,Mel Gibson,101.63,"Maverick (1994) is a Action, Adventure, Comedy film directed by Richard Donner starring Mel Gibson. Rated 7.0 on IMDB."
Stargate,1994,116,7.0,42.0,204367,"Action, Adventure, Sci-Fi",Roland Emmerich,Kurt Russell,71.57,"Stargate (1994) is a Action, Adventure, Sci-Fi film directed by Roland Emmerich starring Kurt Russell. Rated 7.0 on IMDB."
Star Trek: First Contact,1996,111,7.6,70.0,131761,"Action, Adventure, Drama",Jonathan Frakes,Patrick Stewart,92.0,"Star Trek: First Contact (1996) is a Action, Adventure, Drama film directed by Jonathan Frakes starring Patrick Stewart. Rated 7.6 on IMDB."
Sense and Sensibility,1995,136,7.7,84.0,125133,"Drama, Romance",Ang Lee,Emma Thompson,43.18,"Sense and Sensibility (1995) is a Drama, Romance film directed by Ang Lee starring Emma Thompson. Rated 7.7 on IMDB."
Four Weddings and a Funeral,1994,117,7.1,81.0,165418,"Comedy, Drama, Romance",Mike Newell,Hugh Grant,52.7,"Four Weddings and a Funeral (1994) is a Comedy, Drama, Romance film directed by Mike Newell starring Hugh Grant. Rated 7.1 on IMDB."
Toy Story,1995,81,8.3,96.0,1064490,"Animation, Adventure, Comedy",John Lasseter,Tom Hanks,191.8,"Toy Story (1995) is a Animation, Adventure, Comedy film directed by John Lasseter starring Tom Hanks. Rated 8.3 on IMDB."
Good Will Hunting,1997,126,8.3,71.0,1061624,"Drama, Romance",Gus Van Sant,Robin Williams,138.43,"Good Will Hunting (1997) is a Drama, Romance film directed by Gus Van Sant starring Robin Williams. Rated 8.3 on IMDB."
Swing Kids,1993,112,6.7,39.0,17316,"Drama, Music",Thomas Carter,Robert Sean Leonard,5.63,"Swing Kids (1993) is a Drama, Music film directed by Thomas Carter starring Robert Sean Leonard. Rated 6.7 on IMDB."
GATTACA,1997,106,7.7,64.0,322207,"Drama, Sci-Fi, Thriller",Andrew Niccol,Ethan Hawke,12.34,"GATTACA (1997) is a Drama, Sci-Fi, Thriller film directed by Andrew Niccol starring Ethan Hawke. Rated 7.7 on IMDB."
Muriel's Wedding,1994,106,7.2,63.0,41632,"Comedy, Drama",P.J. Hogan,Toni Collette,15.19,"Muriel's Wedding (1994) is a Comedy, Drama film directed by P.J. Hogan starring Toni Collette. Rated 7.2 on IMDB."
The Fugitive,1993,130,7.8,87.0,317223,"Action, Crime, Drama",Andrew Davis,Harrison Ford,183.88,"The Fugitive (1993) is a Action, Crime, Drama film directed by Andrew Davis starring Harrison Ford. Rated 7.8 on IMDB."
The Usual Suspects,1995,106,8.5,76.0,1141534,"Crime, Drama, Mystery",Bryan Singer,Kevin Spacey,23.34,"The Usual Suspects (1995) is a Crime, Drama, Mystery film directed by Bryan Singer starring Kevin Spacey. Rated 8.5 on IMDB."
A Bronx Tale,1993,121,7.8,80.0,160015,"Crime, Drama",Robert De Niro,Robert De Niro,17.27,"A Bronx Tale (1993) is a Crime, Drama film directed by Robert De Niro starring Robert De Niro. Rated 7.8 on IMDB."
True Lies,1994,141,7.3,63.0,279646,"Action, Comedy, Thriller",James Cameron,Arnold Schwarzenegger,146.28,"True Lies (1994) is a Action, Comedy, Thriller film directed by James Cameron starring Arnold Schwarzenegger. Rated 7.3 on IMDB."
GoldenEye,1995,130,7.2,65.0,269619,"Action, Adventure, Thriller",Martin Campbell,Pierce Brosnan,106.6,"GoldenEye (1995) is a Action, Adventure, Thriller film directed by Martin Campbell starring Pierce Brosnan. Rated 7.2 on IMDB."
Cliffhanger,1993,113,6.5,59.0,139517,"Action, Adventure, Thriller",Renny Harlin,Sylvester Stallone,84.05,"Cliffhanger (1993) is a Action, Adventure, Thriller film directed by Renny Harlin starring Sylvester Stallone. Rated 6.5 on IMDB."
Scream,1996,111,7.4,66.0,386718,"Horror, Mystery",Wes Craven,Neve Campbell,103.05,"Scream (1996) is a Horror, Mystery film directed by Wes Craven starring Neve Campbell. Rated 7.4 on IMDB."
Se7en,1995,127,8.6,65.0,1789863,"Crime, Drama, Mystery",David Fincher,Morgan Freeman,100.13,"Se7en (1995) is a Crime, Drama, Mystery film directed by David Fincher starring Morgan Freeman. Rated 8.6 on IMDB."
The Mask,1994,101,6.9,59.0,418296,"Action, Comedy, Crime",Chuck Russell,Jim Carrey,119.94,"The Mask (1994) is a Action, Comedy, Crime film directed by Chuck Russell starring Jim Carrey. Rated 6.9 on IMDB."
Eraser,1996,115,6.2,56.0,118049,"Action, Crime, Thriller",Chuck Russell,Arnold Schwarzenegger,101.3,"Eraser (1996) is a Action, Crime, Thriller film directed by Chuck Russell starring Arnold Schwarzenegger. Rated 6.2 on IMDB."
La haine,1995,98,8.1,61.0,195120,"Crime, Drama",Mathieu Kassovitz,Vincent Cassel,0.31,"La haine (1995) is a Crime, Drama film directed by Mathieu Kassovitz starring Vincent Cassel. Rated 8.1 on IMDB."
The Game,1997,129,7.7,63.0,427486,"Drama, Mystery, Thriller",David Fincher,Michael Douglas,48.32,"The Game (1997) is a Drama, Mystery, Thriller film directed by David Fincher starring Michael Douglas. Rated 7.7 on IMDB."
Mars Attacks!,1996,106,6.4,52.0,242640,"Comedy, Sci-Fi",Tim Burton,Jack Nicholson,37.77,"Mars Attacks! (1996) is a Comedy, Sci-Fi film directed by Tim Burton starring Jack Nicholson. Rated 6.4 on IMDB."
Breaking the Waves,1996,159,7.8,82.0,71377,Drama,Lars von Trier,Emily Watson,4.04,Breaking the Waves (1996) is a Drama film directed by Lars von Trier starring Emily Watson. Rated 7.8 on IMDB.
The English Patient,1996,162,7.4,86.0,199490,"Drama, Romance, War",Anthony Minghella,Ralph Fiennes,78.65,"The English Patient (1996) is a Drama, Romance, War film directed by Anthony Minghella starring Ralph Fiennes. Rated 7.4 on IMDB."
Home Alone 2: Lost in New York,1992,120,6.9,46.0,401214,"Adventure, Comedy, Crime",Chris Columbus,Macaulay Culkin,173.59,"Home Alone 2: Lost in New York (1992) is a Adventure, Comedy, Crime film directed by Chris Columbus starring Macaulay Culkin. Rated 6.9 on IMDB."
Alien Resurrection,1997,109,6.2,62.0,262454,"Action, Horror, Sci-Fi",Jean-Pierre Jeunet,Sigourney Weaver,47.75,"Alien Resurrection (1997) is a Action, Horror, Sci-Fi film directed by Jean-Pierre Jeunet starring Sigourney Weaver. Rated 6.2 on IMDB."
Frankenstein,1994,123,6.3,49.0,59159,"Drama, Horror, Romance",Kenneth Branagh,Robert De Niro,22.01,"Frankenstein (1994) is a Drama, Horror, Romance film directed by Kenneth Branagh starring Robert De Niro. Rated 6.3 on IMDB."
Gettysburg,1993,271,7.6,61.0,31204,"Drama, History, War",Ron Maxwell,Tom Berenger,10.77,"Gettysburg (1993) is a Drama, History, War film directed by Ron Maxwell starring Tom Berenger. Rated 7.6 on IMDB."
Twister,I 1996,113,6.5,68.0,212423,"Action, Adventure, Thriller",Jan de Bont,Helen Hunt,241.72,"Twister (I 1996) is a Action, Adventure, Thriller film directed by Jan de Bont starring Helen Hunt. Rated 6.5 on IMDB."
Jurassic Park,1993,127,8.2,68.0,1062224,"Action, Adventure, Sci-Fi",Steven Spielberg,Sam Neill,402.45,"Jurassic Park (1993) is a Action, Adventure, Sci-Fi film directed by Steven Spielberg starring Sam Neill. Rated 8.2 on IMDB."
Alive,1993,128,7.1,56.0,64182,"Adventure, Biography, Drama",Frank Marshall,Ethan Hawke,36.73,"Alive (1993) is a Adventure, Biography, Drama film directed by Frank Marshall starring Ethan Hawke. Rated 7.1 on IMDB."
My Best Friend's Wedding,1997,105,6.3,51.0,154766,"Comedy, Drama, Romance",P.J. Hogan,Julia Roberts,127.12,"My Best Friend's Wedding (1997) is a Comedy, Drama, Romance film directed by P.J. Hogan starring Julia Roberts. Rated 6.3 on IMDB."
Jerry Maguire,1996,139,7.3,77.0,286023,"Comedy, Drama, Romance",Cameron Crowe,Tom Cruise,153.95,"Jerry Maguire (1996) is a Comedy, Drama, Romance film directed by Cameron Crowe starring Tom Cruise. Rated 7.3 on IMDB."
Friday,1995,91,7.2,54.0,124028,"Comedy, Drama",F. Gary Gray,Ice Cube,27.47,"Friday (1995) is a Comedy, Drama film directed by F. Gary Gray starring Ice Cube. Rated 7.2 on IMDB."
The Piano,1993,121,7.5,89.0,94836,"Drama, Music, Romance",Jane Campion,Holly Hunter,40.16,"The Piano (1993) is a Drama, Music, Romance film directed by Jane Campion starring Holly Hunter. Rated 7.5 on IMDB."
Malcolm X,1992,202,7.7,73.0,101719,"Biography, Drama, History",Spike Lee,Denzel Washington,48.17,"Malcolm X (1992) is a Biography, Drama, History film directed by Spike Lee starring Denzel Washington. Rated 7.7 on IMDB."
Legends of the Fall,1994,133,7.5,45.0,182080,"Drama, Romance, War",Edward Zwick,Brad Pitt,66.64,"Legends of the Fall (1994) is a Drama, Romance, War film directed by Edward Zwick starring Brad Pitt. Rated 7.5 on IMDB."
Scent of a Woman,1992,156,8.0,57.0,327228,Drama,Martin Brest,Al Pacino,63.9,Scent of a Woman (1992) is a Drama film directed by Martin Brest starring Al Pacino. Rated 8.0 on IMDB.
Tomorrow Never Dies,1997,119,6.5,52.0,204232,"Action, Adventure, Thriller",Roger Spottiswoode,Pierce Brosnan,125.33,"Tomorrow Never Dies (1997) is a Action, Adventure, Thriller film directed by Roger Spottiswoode starring Pierce Brosnan. Rated 6.5 on IMDB."
The Remains of the Day,1993,134,7.8,86.0,83943,"Drama, Romance",James Ivory,Anthony Hopkins,22.95,"The Remains of the Day (1993) is a Drama, Romance film directed by James Ivory starring Anthony Hopkins. Rated 7.8 on IMDB."
Babe,1995,91,6.9,83.0,133697,"Comedy, Drama, Family",Chris Noonan,James Cromwell,66.6,"Babe (1995) is a Comedy, Drama, Family film directed by Chris Noonan starring James Cromwell. Rated 6.9 on IMDB."
Happy Gilmore,1996,92,7.0,31.0,246530,"Comedy, Sport",Dennis Dugan,Adam Sandler,38.62,"Happy Gilmore (1996) is a Comedy, Sport film directed by Dennis Dugan starring Adam Sandler. Rated 7.0 on IMDB."
Leprechaun,1992,92,4.8,17.0,30322,"Comedy, Fantasy, Horror",Mark Jones,Warwick Davis,8.56,"Leprechaun (1992) is a Comedy, Fantasy, Horror film directed by Mark Jones starring Warwick Davis. Rated 4.8 on IMDB."
Forrest Gump,1994,142,8.8,82.0,2245598,"Drama, Romance",Robert Zemeckis,Tom Hanks,330.25,"Forrest Gump (1994) is a Drama, Romance film directed by Robert Zemeckis starring Tom Hanks. Rated 8.8 on IMDB."
MADtv,1995–2016,60,7.2,61.0,11871,Comedy,Michael McDonald,Debra Wilson,44.82,MADtv (1995–2016) is a Comedy film directed by Michael McDonald starring Debra Wilson. Rated 7.2 on IMDB.
Natural Born Killers,1994,119,7.2,74.0,250971,"Action, Crime, Romance",Oliver Stone,Woody Harrelson,50.28,"Natural Born Killers (1994) is a Action, Crime, Romance film directed by Oliver Stone starring Woody Harrelson. Rated 7.2 on IMDB."
Outbreak,1995,127,6.6,64.0,137387,"Action, Drama, Thriller",Wolfgang Petersen,Dustin Hoffman,67.82,"Outbreak (1995) is a Action, Drama, Thriller film directed by Wolfgang Petersen starring Dustin Hoffman. Rated 6.6 on IMDB."
Last Action Hero,1993,130,6.5,44.0,163122,"Action, Adventure, Comedy",John McTiernan,Arnold Schwarzenegger,50.02,"Last Action Hero (1993) is a Action, Adventure, Comedy film directed by John McTiernan starring Arnold Schwarzenegger. Rated 6.5 on IMDB."
The Lost World: Jurassic Park,1997,129,6.5,59.0,442497,"Action, Adventure, Sci-Fi",Steven Spielberg,Jeff Goldblum,229.09,"The Lost World: Jurassic Park (1997) is a Action, Adventure, Sci-Fi film directed by Steven Spielberg starring Jeff Goldblum. Rated 6.5 on IMDB."
Romeo + Juliet,1996,120,6.7,60.0,243939,"Drama, Romance",Baz Luhrmann,Leonardo DiCaprio,46.35,"Romeo + Juliet (1996) is a Drama, Romance film directed by Baz Luhrmann starring Leonardo DiCaprio. Rated 6.7 on IMDB."
The Sandlot,1993,101,7.8,55.0,101863,"Comedy, Drama, Family",David Mickey Evans,Tom Guiry,32.42,"The Sandlot (1993) is a Comedy, Drama, Family film directed by David Mickey Evans starring Tom Guiry. Rated 7.8 on IMDB."
D2: The Mighty Ducks,1994,106,6.1,61.0,42925,"Comedy, Drama, Family",Sam Weisman,Emilio Estevez,45.61,"D2: The Mighty Ducks (1994) is a Comedy, Drama, Family film directed by Sam Weisman starring Emilio Estevez. Rated 6.1 on IMDB."
The Devil's Advocate,1997,144,7.5,60.0,400364,"Drama, Fantasy, Mystery",Taylor Hackford,Keanu Reeves,60.98,"The Devil's Advocate (1997) is a Drama, Fantasy, Mystery film directed by Taylor Hackford starring Keanu Reeves. Rated 7.5 on IMDB."
The Rainmaker,1997,135,7.2,72.0,82595,"Crime, Drama, Thriller",Francis Ford Coppola,Matt Damon,45.86,"The Rainmaker (1997) is a Crime, Drama, Thriller film directed by Francis Ford Coppola starring Matt Damon. Rated 7.2 on IMDB."
A Time to Kill,1996,149,7.5,53.0,180913,"Crime, Drama, Thriller",Joel Schumacher,Matthew McConaughey,108.77,"A Time to Kill (1996) is a Crime, Drama, Thriller film directed by Joel Schumacher starring Matthew McConaughey. Rated 7.5 on IMDB."
