Movie Name,Release Year,Duration,IMDB Rating,Metascore,Votes,Genre,Director,Cast,Gross,Overview
Kung Fu Panda,2008,92,7.6,74.0,517575,"Animation, Action, Adventure",Mark Osborne,John Stevenson,215.43,"Kung Fu Panda (2008) is a Animation, Action, Adventure film directed by Mark Osborne starring John Stevenson. Rated 7.6 on IMDB."
Transformers,2007,144,7.0,61.0,672869,"Action, Adventure, Sci-Fi",Michael Bay,Shia LaBeouf,319.25,"Transformers (2007) is a Action, Adventure, Sci-Fi film directed by Michael Bay starring Shia LaBeouf. Rated 7.0 on IMDB."
Sex and the City,2008,145,5.7,53.0,127010,"Comedy, Drama, Romance",Michael Patrick King,Sarah Jessica Parker,152.65,"Sex and the City (2008) is a Comedy, Drama, Romance film directed by Michael Patrick King starring Sarah Jessica Parker. Rated 5.7 on IMDB."
The Prestige,2006,130,8.5,66.0,1434855,"Drama, Mystery, Sci-Fi",Christopher Nolan,Christian Bale,53.09,"The Prestige (2006) is a Drama, Mystery, Sci-Fi film directed by Christopher Nolan starring Christian Bale. Rated 8.5 on IMDB."
The Dark Knight,2008,152,9.0,84.0,2857781,"Action, Crime, Drama",Christopher Nolan,Christian Bale,534.86,"The Dark Knight (2008) is a Action, Crime, Drama film directed by Christopher Nolan starring Christian Bale. Rated 9.0 on IMDB."
Spider-Man 3,2007,139,6.3,59.0,634791,"Action, Adventure, Sci-Fi",Sam Raimi,Tobey Maguire,336.53,"Spider-Man 3 (2007) is a Action, Adventure, Sci-Fi film directed by Sam Raimi starring Tobey Maguire. Rated 6.3 on IMDB."
Live Free or Die Hard,2007,128,7.1,69.0,420007,"Action, Thriller",Len Wiseman,Bruce Willis,134.53,"Live Free or Die Hard (2007) is a Action, Thriller film directed by Len Wiseman starring Bruce Willis. Rated 7.1 on IMDB."
Flags of Our Fathers,2006,135,7.1,79.0,128955,"Action, Adventure, Drama",Clint Eastwood,Ryan Phillippe,33.6,"Flags of Our Fathers (2006) is a Action, Adventure, Drama film directed by Clint Eastwood starring Ryan Phillippe. Rated 7.1 on IMDB."
In the Valley of Elah,2007,121,7.2,65.0,74998,"Crime, Drama, Mystery",Paul Haggis,Tommy Lee Jones,6.78,"In the Valley of Elah (2007) is a Crime, Drama, Mystery film directed by Paul Haggis starring Tommy Lee Jones. Rated 7.2 on IMDB."
Wanted,2008,110,6.7,64.0,407561,"Action, Crime, Thriller",Timur Bekmambetov,Angelina Jolie,134.51,"Wanted (2008) is a Action, Crime, Thriller film directed by Timur Bekmambetov starring Angelina Jolie. Rated 6.7 on IMDB."
American Gangster,2007,157,7.8,76.0,451083,"Biography, Crime, Drama",Ridley Scott,Denzel Washington,130.16,"American Gangster (2007) is a Biography, Crime, Drama film directed by Ridley Scott starring Denzel Washington. Rated 7.8 on IMDB."
Pirates of the Caribbean: At World's End,2007,169,7.1,50.0,690894,"Action, Adventure, Fantasy",Gore Verbinski,Johnny Depp,309.42,"Pirates of the Caribbean: At World's End (2007) is a Action, Adventure, Fantasy film directed by Gore Verbinski starring Johnny Depp. Rated 7.1 on IMDB."
Vantage Point,2008,90,6.6,40.0,153918,"Action, Crime, Drama",Pete Travis,Dennis Quaid,72.27,"Vantage Point (2008) is a Action, Crime, Drama film directed by Pete Travis starring Dennis Quaid. Rated 6.6 on IMDB."
Bobby,I 2006,117,7.0,54.0,42775,"Biography, Drama, History",Emilio Estevez,Anthony Hopkins,11.24,"Bobby (I 2006) is a Biography, Drama, History film directed by Emilio Estevez starring Anthony Hopkins. Rated 7.0 on IMDB."
Children of Men,2006,109,7.9,84.0,527906,"Action, Drama, Sci-Fi",Alfonso Cuarón,Julianne Moore,35.55,"Children of Men (2006) is a Action, Drama, Sci-Fi film directed by Alfonso Cuarón starring Julianne Moore. Rated 7.9 on IMDB."
El orfanato,2007,105,7.4,74.0,163247,"Drama, Horror, Mystery",J.A. Bayona,Belén Rueda,7.16,"El orfanato (2007) is a Drama, Horror, Mystery film directed by J.A. Bayona starring Belén Rueda. Rated 7.4 on IMDB."
Death at a Funeral,2007,90,7.3,67.0,120687,Comedy,Frank Oz,Matthew Macfadyen,8.58,Death at a Funeral (2007) is a Comedy film directed by Frank Oz starring Matthew Macfadyen. Rated 7.3 on IMDB.
Stardust,2007,127,7.6,66.0,284495,"Adventure, Family, Fantasy",Matthew Vaughn,Charlie Cox,38.63,"Stardust (2007) is a Adventure, Family, Fantasy film directed by Matthew Vaughn starring Charlie Cox. Rated 7.6 on IMDB."
28 Weeks Later,2007,100,6.9,78.0,292725,"Horror, Sci-Fi",Juan Carlos Fresnadillo,Jeremy Renner,28.64,"28 Weeks Later (2007) is a Horror, Sci-Fi film directed by Juan Carlos Fresnadillo starring Jeremy Renner. Rated 6.9 on IMDB."
The Bank Job,2008,111,7.2,69.0,188862,"Crime, Drama, Thriller",Roger Donaldson,Jason Statham,30.06,"The Bank Job (2008) is a Crime, Drama, Thriller film directed by Roger Donaldson starring Jason Statham. Rated 7.2 on IMDB."
The Mist,2007,126,7.1,58.0,338669,"Horror, Sci-Fi, Thriller",Frank Darabont,Thomas Jane,25.59,"The Mist (2007) is a Horror, Sci-Fi, Thriller film directed by Frank Darabont starring Thomas Jane. Rated 7.1 on IMDB."
Into the Wild,2007,148,8.1,73.0,656177,"Adventure, Biography, Drama",Sean Penn,Emile Hirsch,18.35,"Into the Wild (2007) is a Adventure, Biography, Drama film directed by Sean Penn starring Emile Hirsch. Rated 8.1 on IMDB."
Indiana Jones and the Kingdom of the Crystal Skull,2008,122,6.2,65.0,490218,"Action, Adventure",Steven Spielberg,Harrison Ford,317.1,"Indiana Jones and the Kingdom of the Crystal Skull (2008) is a Action, Adventure film directed by Steven Spielberg starring Harrison Ford. Rated 6.2 on IMDB."
There Will Be Blood,2007,158,8.2,93.0,638623,Drama,Paul Thomas Anderson,Daniel Day-Lewis,40.22,There Will Be Blood (2007) is a Drama film directed by Paul Thomas Anderson starring Daniel Day-Lewis. Rated 8.2 on IMDB.
Juno,2007,96,7.4,81.0,547809,"Comedy, Drama",Jason Reitman,Elliot Page,143.5,"Juno (2007) is a Comedy, Drama film directed by Jason Reitman starring Elliot Page. Rated 7.4 on IMDB."
Step Brothers,2008,98,6.9,51.0,317818,Comedy,Adam McKay,Will Ferrell,100.47,Step Brothers (2008) is a Comedy film directed by Adam McKay starring Will Ferrell. Rated 6.9 on IMDB.
This Is England,2006,101,7.7,86.0,128440,"Crime, Drama",Shane Meadows,Thomas Turgoose,0.33,"This Is England (2006) is a Crime, Drama film directed by Shane Meadows starring Thomas Turgoose. Rated 7.7 on IMDB."
I Am Legend,2007,101,7.2,65.0,810756,"Action, Drama, Horror",Francis Lawrence,Will Smith,256.39,"I Am Legend (2007) is a Action, Drama, Horror film directed by Francis Lawrence starring Will Smith. Rated 7.2 on IMDB."
The Bourne Ultimatum,2007,115,8.0,85.0,657022,"Action, Mystery, Thriller",Paul Greengrass,Matt Damon,227.47,"The Bourne Ultimatum (2007) is a Action, Mystery, Thriller film directed by Paul Greengrass starring Matt Damon. Rated 8.0 on IMDB."
The Fall,I 2006,117,7.8,64.0,116481,"Adventure, Drama, Fantasy",Tarsem Singh,Lee Pace,2.28,"The Fall (I 2006) is a Adventure, Drama, Fantasy film directed by Tarsem Singh starring Lee Pace. Rated 7.8 on IMDB."
Hot Fuzz,2007,121,7.8,81.0,533847,"Action, Comedy, Mystery",Edgar Wright,Simon Pegg,23.64,"Hot Fuzz (2007) is a Action, Comedy, Mystery film directed by Edgar Wright starring Simon Pegg. Rated 7.8 on IMDB."
Get Smart,2008,110,6.5,54.0,228169,"Action, Adventure, Comedy",Peter Segal,Steve Carell,130.32,"Get Smart (2008) is a Action, Adventure, Comedy film directed by Peter Segal starring Steve Carell. Rated 6.5 on IMDB."
Enchanted,2007,107,7.1,75.0,216728,"Animation, Adventure, Comedy",Kevin Lima,Amy Adams,127.81,"Enchanted (2007) is a Animation, Adventure, Comedy film directed by Kevin Lima starring Amy Adams. Rated 7.1 on IMDB."
The Pursuit of Happyness,2006,117,8.0,64.0,558156,"Biography, Drama",Gabriele Muccino,Will Smith,163.57,"The Pursuit of Happyness (2006) is a Biography, Drama film directed by Gabriele Muccino starring Will Smith. Rated 8.0 on IMDB."
The Chronicles of Narnia: Prince Caspian,2008,150,6.5,62.0,224726,"Action, Adventure, Family",Andrew Adamson,Ben Barnes,141.62,"The Chronicles of Narnia: Prince Caspian (2008) is a Action, Adventure, Family film directed by Andrew Adamson starring Ben Barnes. Rated 6.5 on IMDB."
Bee Movie,2007,91,6.1,54.0,178969,"Animation, Adventure, Comedy",Simon J. Smith,Steve Hickner,126.63,"Bee Movie (2007) is a Animation, Adventure, Comedy film directed by Simon J. Smith starring Steve Hickner. Rated 6.1 on IMDB."
Zodiac,2007,157,7.7,79.0,595389,"Crime, Drama, Mystery",David Fincher,Jake Gyllenhaal,33.08,"Zodiac (2007) is a Crime, Drama, Mystery film directed by David Fincher starring Jake Gyllenhaal. Rated 7.7 on IMDB."
Slumdog Millionaire,2008,120,8.0,84.0,875740,"Crime, Drama, Romance",Danny Boyle,Loveleen Tandan,141.32,"Slumdog Millionaire (2008) is a Crime, Drama, Romance film directed by Danny Boyle starring Loveleen Tandan. Rated 8.0 on IMDB."
Deja Vu,2006,126,7.1,59.0,326714,"Action, Crime, Sci-Fi",Tony Scott,Denzel Washington,64.04,"Deja Vu (2006) is a Action, Crime, Sci-Fi film directed by Tony Scott starring Denzel Washington. Rated 7.1 on IMDB."
Ratatouille,2007,111,8.1,96.0,819403,"Animation, Adventure, Comedy",Brad Bird,Jan Pinkava,206.45,"Ratatouille (2007) is a Animation, Adventure, Comedy film directed by Brad Bird starring Jan Pinkava. Rated 8.1 on IMDB."
Hellboy II: The Golden Army,2008,120,7.0,78.0,285184,"Action, Adventure, Fantasy",Guillermo del Toro,Ron Perlman,75.75,"Hellboy II: The Golden Army (2008) is a Action, Adventure, Fantasy film directed by Guillermo del Toro starring Ron Perlman. Rated 7.0 on IMDB."
Zwartboek,2006,145,7.7,71.0,80318,"Drama, Thriller, War",Paul Verhoeven,Carice van Houten,4.4,"Zwartboek (2006) is a Drama, Thriller, War film directed by Paul Verhoeven starring Carice van Houten. Rated 7.7 on IMDB."
Zack and Miri Make a Porno,2008,101,6.5,56.0,182059,"Comedy, Romance",Kevin Smith,Seth Rogen,31.46,"Zack and Miri Make a Porno (2008) is a Comedy, Romance film directed by Kevin Smith starring Seth Rogen. Rated 6.5 on IMDB."
Pineapple Express,2008,111,6.9,64.0,356520,"Action, Comedy, Crime",David Gordon Green,Seth Rogen,87.34,"Pineapple Express (2008) is a Action, Comedy, Crime film directed by David Gordon Green starring Seth Rogen. Rated 6.9 on IMDB."
Lars and the Real Girl,2007,106,7.3,70.0,154818,"Comedy, Drama, Romance",Craig Gillespie,Ryan Gosling,5.97,"Lars and the Real Girl (2007) is a Comedy, Drama, Romance film directed by Craig Gillespie starring Ryan Gosling. Rated 7.3 on IMDB."
Jumper,2008,88,6.1,35.0,322694,"Action, Adventure, Sci-Fi",Doug Liman,Hayden Christensen,80.17,"Jumper (2008) is a Action, Adventure, Sci-Fi film directed by Doug Liman starring Hayden Christensen. Rated 6.1 on IMDB."
Le scaphandre et le papillon,2007,112,8.0,92.0,110296,"Biography, Drama",Julian Schnabel,Mathieu Amalric,5.99,"Le scaphandre et le papillon (2007) is a Biography, Drama film directed by Julian Schnabel starring Mathieu Amalric. Rated 8.0 on IMDB."
Superbad,2007,113,7.6,76.0,629534,Comedy,Greg Mottola,Michael Cera,121.46,Superbad (2007) is a Comedy film directed by Greg Mottola starring Michael Cera. Rated 7.6 on IMDB.
Vicky Cristina Barcelona,2008,96,7.1,70.0,268302,"Comedy, Drama, Romance",Woody Allen,Rebecca Hall,23.22,"Vicky Cristina Barcelona (2008) is a Comedy, Drama, Romance film directed by Woody Allen starring Rebecca Hall. Rated 7.1 on IMDB."
The Incredible Hulk,2008,112,6.6,61.0,521846,"Action, Adventure, Sci-Fi",Louis Leterrier,Edward Norton,134.52,"The Incredible Hulk (2008) is a Action, Adventure, Sci-Fi film directed by Louis Leterrier starring Edward Norton. Rated 6.6 on IMDB."
Mongol,2007,126,7.2,74.0,49038,"Action, Biography, Drama",Sergei Bodrov,Tadanobu Asano,5.7,"Mongol (2007) is a Action, Biography, Drama film directed by Sergei Bodrov starring Tadanobu Asano. Rated 7.2 on IMDB."
Night at the Museum,2006,108,6.5,48.0,375797,"Adventure, Comedy, Family",Shawn Levy,Ben Stiller,250.86,"Night at the Museum (2006) is a Adventure, Comedy, Family film directed by Shawn Levy starring Ben Stiller. Rated 6.5 on IMDB."
The Man from Earth,2007,87,7.8,61.0,199410,"Drama, Fantasy, Mystery",Richard Schenkman,David Lee Smith,44.82,"The Man from Earth (2007) is a Drama, Fantasy, Mystery film directed by Richard Schenkman starring David Lee Smith. Rated 7.8 on IMDB."
Evan Almighty,2007,96,5.4,37.0,154714,"Comedy, Family, Fantasy",Tom Shadyac,Steve Carell,100.46,"Evan Almighty (2007) is a Comedy, Family, Fantasy film directed by Tom Shadyac starring Steve Carell. Rated 5.4 on IMDB."
Mr. Brooks,2007,120,7.3,45.0,156030,"Crime, Drama, Mystery",Bruce A. Evans,Kevin Costner,28.48,"Mr. Brooks (2007) is a Crime, Drama, Mystery film directed by Bruce A. Evans starring Kevin Costner. Rated 7.3 on IMDB."
The Simpsons Movie,2007,87,7.3,80.0,348885,"Animation, Adventure, Comedy",David Silverman,Dan Castellaneta,183.14,"The Simpsons Movie (2007) is a Animation, Adventure, Comedy film directed by David Silverman starring Dan Castellaneta. Rated 7.3 on IMDB."
The Reaping,2007,99,5.6,36.0,44592,"Horror, Thriller",Stephen Hopkins,Hilary Swank,25.12,"The Reaping (2007) is a Horror, Thriller film directed by Stephen Hopkins starring Hilary Swank. Rated 5.6 on IMDB."
Bridge to Terabithia,2007,96,7.2,74.0,172471,"Drama, Family, Fantasy",Gabor Csupo,Josh Hutcherson,82.27,"Bridge to Terabithia (2007) is a Drama, Family, Fantasy film directed by Gabor Csupo starring Josh Hutcherson. Rated 7.2 on IMDB."
WALL·E,2008,98,8.4,95.0,1195402,"Animation, Adventure, Family",Andrew Stanton,Ben Burtt,223.81,"WALL·E (2008) is a Animation, Adventure, Family film directed by Andrew Stanton starring Ben Burtt. Rated 8.4 on IMDB."
Shooter,I 2007,124,7.1,53.0,354161,"Action, Drama, Thriller",Antoine Fuqua,Mark Wahlberg,47.0,"Shooter (I 2007) is a Action, Drama, Thriller film directed by Antoine Fuqua starring Mark Wahlberg. Rated 7.1 on IMDB."
Forgetting Sarah Marshall,2008,111,7.1,67.0,301667,"Comedy, Drama, Romance",Nicholas Stoller,Kristen Bell,63.17,"Forgetting Sarah Marshall (2008) is a Comedy, Drama, Romance film directed by Nicholas Stoller starring Kristen Bell. Rated 7.1 on IMDB."
Dreamgirls,2006,130,6.6,76.0,77101,"Drama, Music, Musical",Bill Condon,Beyoncé,103.37,"Dreamgirls (2006) is a Drama, Music, Musical film directed by Bill Condon starring Beyoncé. Rated 6.6 on IMDB."
Superhero Movie,2008,75,4.7,33.0,75148,"Action, Comedy, Sci-Fi",Craig Mazin,Drake Bell,26.64,"Superhero Movie (2008) is a Action, Comedy, Sci-Fi film directed by Craig Mazin starring Drake Bell. Rated 4.7 on IMDB."
Rocky Balboa,2006,102,7.1,63.0,230946,"Action, Drama, Sport",Sylvester Stallone,Sylvester Stallone,70.27,"Rocky Balboa (2006) is a Action, Drama, Sport film directed by Sylvester Stallone starring Sylvester Stallone. Rated 7.1 on IMDB."
Rambo,2008,92,7.0,46.0,243951,"Action, Adventure, Thriller",Sylvester Stallone,Sylvester Stallone,42.75,"Rambo (2008) is a Action, Adventure, Thriller film directed by Sylvester Stallone starring Sylvester Stallone. Rated 7.0 on IMDB."
Iron Man,2008,126,7.9,79.0,1120556,"Action, Adventure, Sci-Fi",Jon Favreau,Robert Downey Jr.,318.41,"Iron Man (2008) is a Action, Adventure, Sci-Fi film directed by Jon Favreau starring Robert Downey Jr.. Rated 7.9 on IMDB."
Gone Baby Gone,2007,114,7.6,72.0,291847,"Crime, Drama, Mystery",Ben Affleck,Morgan Freeman,20.3,"Gone Baby Gone (2007) is a Crime, Drama, Mystery film directed by Ben Affleck starring Morgan Freeman. Rated 7.6 on IMDB."
All the Boys Love Mandy Lane,2006,90,5.5,44.0,34700,"Horror, Mystery, Thriller",Jonathan Levine,Amber Heard,44.82,"All the Boys Love Mandy Lane (2006) is a Horror, Mystery, Thriller film directed by Jonathan Levine starring Amber Heard. Rated 5.5 on IMDB."
Felon,2008,104,7.4,58.0,83393,"Crime, Thriller",Ric Roman Waugh,Stephen Dorff,0.04,"Felon (2008) is a Crime, Thriller film directed by Ric Roman Waugh starring Stephen Dorff. Rated 7.4 on IMDB."
Nick and Norah's Infinite Playlist,2008,90,6.6,64.0,95267,"Comedy, Drama, Music",Peter Sollett,Michael Cera,31.49,"Nick and Norah's Infinite Playlist (2008) is a Comedy, Drama, Music film directed by Peter Sollett starring Michael Cera. Rated 6.6 on IMDB."
Harold & Kumar Escape from Guantanamo Bay,2008,114,6.5,57.0,141785,"Adventure, Comedy",Jon Hurwitz,Hayden Schlossberg,38.09,"Harold & Kumar Escape from Guantanamo Bay (2008) is a Adventure, Comedy film directed by Jon Hurwitz starring Hayden Schlossberg. Rated 6.5 on IMDB."
21,2008,123,6.8,48.0,265859,"Crime, Drama, Thriller",Robert Luketic,Jim Sturgess,81.16,"21 (2008) is a Crime, Drama, Thriller film directed by Robert Luketic starring Jim Sturgess. Rated 6.8 on IMDB."
Across the Universe,2007,133,7.3,56.0,114097,"Drama, Fantasy, History",Julie Taymor,Evan Rachel Wood,51.66,"Across the Universe (2007) is a Drama, Fantasy, History film directed by Julie Taymor starring Evan Rachel Wood. Rated 7.3 on IMDB."
Knocked Up,2007,129,6.9,85.0,383634,"Comedy, Romance",Judd Apatow,Seth Rogen,148.73,"Knocked Up (2007) is a Comedy, Romance film directed by Judd Apatow starring Seth Rogen. Rated 6.9 on IMDB."
Eagle Eye,2008,118,6.6,43.0,194922,"Action, Mystery, Thriller",D.J. Caruso,Shia LaBeouf,101.11,"Eagle Eye (2008) is a Action, Mystery, Thriller film directed by D.J. Caruso starring Shia LaBeouf. Rated 6.6 on IMDB."
Disturbia,2007,105,6.8,62.0,247378,"Crime, Drama, Mystery",D.J. Caruso,Shia LaBeouf,80.21,"Disturbia (2007) is a Crime, Drama, Mystery film directed by D.J. Caruso starring Shia LaBeouf. Rated 6.8 on IMDB."
3:10 to Yuma,2007,122,7.6,76.0,330276,"Action, Crime, Drama",James Mangold,Russell Crowe,53.61,"3:10 to Yuma (2007) is a Action, Crime, Drama film directed by James Mangold starring Russell Crowe. Rated 7.6 on IMDB."
Rush Hour 3,2007,91,6.2,44.0,182503,"Action, Comedy, Crime",Brett Ratner,Jackie Chan,140.13,"Rush Hour 3 (2007) is a Action, Comedy, Crime film directed by Brett Ratner starring Jackie Chan. Rated 6.2 on IMDB."
Beowulf,2007,115,6.3,59.0,173877,"Animation, Action, Adventure",Robert Zemeckis,Ray Winstone,82.16,"Beowulf (2007) is a Animation, Action, Adventure film directed by Robert Zemeckis starring Ray Winstone. Rated 6.3 on IMDB."
Horton Hears a Who!,2008,86,6.8,71.0,149876,"Animation, Adventure, Comedy",Jimmy Hayward,Steve Martino,154.53,"Horton Hears a Who! (2008) is a Animation, Adventure, Comedy film directed by Jimmy Hayward starring Steve Martino. Rated 6.8 on IMDB."
The Holiday,2006,136,6.9,52.0,321909,"Comedy, Romance",Nancy Meyers,Kate Winslet,63.22,"The Holiday (2006) is a Comedy, Romance film directed by Nancy Meyers starring Kate Winslet. Rated 6.9 on IMDB."
Blood Diamond,2006,143,8.0,64.0,583989,"Adventure, Drama, Thriller",Edward Zwick,Leonardo DiCaprio,57.37,"Blood Diamond (2006) is a Adventure, Drama, Thriller film directed by Edward Zwick starring Leonardo DiCaprio. Rated 8.0 on IMDB."
The Darjeeling Limited,2007,91,7.2,67.0,216368,"Adventure, Comedy, Drama",Wes Anderson,Owen Wilson,11.9,"The Darjeeling Limited (2007) is a Adventure, Comedy, Drama film directed by Wes Anderson starring Owen Wilson. Rated 7.2 on IMDB."
Righteous Kill,2008,101,6.0,36.0,92036,"Crime, Mystery, Thriller",Jon Avnet,Robert De Niro,40.08,"Righteous Kill (2008) is a Crime, Mystery, Thriller film directed by Jon Avnet starring Robert De Niro. Rated 6.0 on IMDB."
Choke,2008,92,6.4,47.0,33551,"Comedy, Drama",Clark Gregg,Sam Rockwell,2.93,"Choke (2008) is a Comedy, Drama film directed by Clark Gregg starring Sam Rockwell. Rated 6.4 on IMDB."
In Bruges,2008,107,7.9,67.0,460148,"Comedy, Crime, Drama",Martin McDonagh,Colin Farrell,7.76,"In Bruges (2008) is a Comedy, Crime, Drama film directed by Martin McDonagh starring Colin Farrell. Rated 7.9 on IMDB."
Smokin' Aces,2006,109,6.6,45.0,151771,"Action, Comedy, Crime",Joe Carnahan,Jeremy Piven,35.66,"Smokin' Aces (2006) is a Action, Comedy, Crime film directed by Joe Carnahan starring Jeremy Piven. Rated 6.6 on IMDB."
A Good Year,2006,117,6.9,47.0,101093,"Comedy, Drama, Romance",Ridley Scott,Russell Crowe,7.46,"A Good Year (2006) is a Comedy, Drama, Romance film directed by Ridley Scott starring Russell Crowe. Rated 6.9 on IMDB."
Meet the Robinsons,2007,95,6.8,61.0,110902,"Animation, Adventure, Comedy",Stephen J. Anderson,Daniel Hansen,97.82,"Meet the Robinsons (2007) is a Animation, Adventure, Comedy film directed by Stephen J. Anderson starring Daniel Hansen. Rated 6.8 on IMDB."
The Great Debaters,2007,126,7.5,65.0,62663,"Biography, Drama, Romance",Denzel Washington,Denzel Washington,30.23,"The Great Debaters (2007) is a Biography, Drama, Romance film directed by Denzel Washington starring Denzel Washington. Rated 7.5 on IMDB."
You Don't Mess with the Zohan,2008,113,5.6,54.0,213515,"Action, Comedy",Dennis Dugan,Adam Sandler,100.02,"You Don't Mess with the Zohan (2008) is a Action, Comedy film directed by Dennis Dugan starring Adam Sandler. Rated 5.6 on IMDB."
The Number 23,2007,98,6.4,61.0,212168,"Crime, Mystery, Thriller",Joel Schumacher,Jim Carrey,35.19,"The Number 23 (2007) is a Crime, Mystery, Thriller film directed by Joel Schumacher starring Jim Carrey. Rated 6.4 on IMDB."
Tropic Thunder,2008,107,7.1,71.0,446392,"Action, Comedy, War",Ben Stiller,Ben Stiller,110.52,"Tropic Thunder (2008) is a Action, Comedy, War film directed by Ben Stiller starring Ben Stiller. Rated 7.1 on IMDB."
Burn After Reading,2008,96,7.0,63.0,352108,"Comedy, Crime, Drama",Ethan Coen,Joel Coen,60.36,"Burn After Reading (2008) is a Comedy, Crime, Drama film directed by Ethan Coen starring Joel Coen. Rated 7.0 on IMDB."
Mamma Mia!,2008,108,6.5,51.0,272789,"Comedy, Musical, Romance",Phyllida Lloyd,Meryl Streep,144.13,"Mamma Mia! (2008) is a Comedy, Musical, Romance film directed by Phyllida Lloyd starring Meryl Streep. Rated 6.5 on IMDB."
Death Race,2008,105,6.4,43.0,218463,"Action, Sci-Fi, Thriller",Paul W.S. Anderson,Jason Statham,36.32,"Death Race (2008) is a Action, Sci-Fi, Thriller film directed by Paul W.S. Anderson starring Jason Statham. Rated 6.4 on IMDB."
Trick 'r Treat,2007,82,6.7,61.0,104428,"Comedy, Horror",Michael Dougherty,Anna Paquin,44.82,"Trick 'r Treat (2007) is a Comedy, Horror film directed by Michael Dougherty starring Anna Paquin. Rated 6.7 on IMDB."
The Brothers Bloom,2008,114,6.7,55.0,52516,"Action, Adventure, Comedy",Rian Johnson,Rachel Weisz,3.52,"The Brothers Bloom (2008) is a Action, Adventure, Comedy film directed by Rian Johnson starring Rachel Weisz. Rated 6.7 on IMDB."
It's a Boy Girl Thing,2006,95,6.2,61.0,42753,"Comedy, Fantasy, Romance",Nick Hurran,Samaire Armstrong,44.82,"It's a Boy Girl Thing (2006) is a Comedy, Fantasy, Romance film directed by Nick Hurran starring Samaire Armstrong. Rated 6.2 on IMDB."
Saw III,2006,108,6.2,48.0,211605,"Horror, Mystery, Thriller",Darren Lynn Bousman,Tobin Bell,80.24,"Saw III (2006) is a Horror, Mystery, Thriller film directed by Darren Lynn Bousman starring Tobin Bell. Rated 6.2 on IMDB."
War,2007,103,6.2,36.0,96554,"Action, Crime, Thriller",Philip G. Atwell,Jet Li,22.49,"War (2007) is a Action, Crime, Thriller film directed by Philip G. Atwell starring Jet Li. Rated 6.2 on IMDB."
Tenacious D in The Pick of Destiny,2006,94,6.8,55.0,114914,"Adventure, Comedy, Music",Liam Lynch,Jack Black,8.32,"Tenacious D in The Pick of Destiny (2006) is a Adventure, Comedy, Music film directed by Liam Lynch starring Jack Black. Rated 6.8 on IMDB."
DOA: Dead or Alive,2006,87,4.8,38.0,46251,"Action, Adventure, Mystery",Corey Yuen,Jaime Pressly,0.48,"DOA: Dead or Alive (2006) is a Action, Adventure, Mystery film directed by Corey Yuen starring Jaime Pressly. Rated 4.8 on IMDB."
Saw IV,2007,93,5.9,36.0,164246,"Horror, Mystery, Thriller",Darren Lynn Bousman,Tobin Bell,63.3,"Saw IV (2007) is a Horror, Mystery, Thriller film directed by Darren Lynn Bousman starring Tobin Bell. Rated 5.9 on IMDB."
What Happens in Vegas,2008,99,6.1,36.0,187386,"Comedy, Romance",Tom Vaughan,Cameron Diaz,80.28,"What Happens in Vegas (2008) is a Comedy, Romance film directed by Tom Vaughan starring Cameron Diaz. Rated 6.1 on IMDB."
300,2006,117,7.6,52.0,861700,"Action, Drama",Zack Snyder,Gerard Butler,210.61,"300 (2006) is a Action, Drama film directed by Zack Snyder starring Gerard Butler. Rated 7.6 on IMDB."
We Own the Night,2007,117,6.8,59.0,92647,"Action, Crime, Drama",James Gray,Joaquin Phoenix,28.56,"We Own the Night (2007) is a Action, Crime, Drama film directed by James Gray starring Joaquin Phoenix. Rated 6.8 on IMDB."
Charlie Wilson's War,2007,102,7.0,67.0,124652,"Biography, Comedy, Drama",Mike Nichols,Tom Hanks,66.66,"Charlie Wilson's War (2007) is a Biography, Comedy, Drama film directed by Mike Nichols starring Tom Hanks. Rated 7.0 on IMDB."
TMNT,2007,87,6.2,41.0,69092,"Animation, Action, Adventure",Kevin Munroe,Patrick Stewart,54.15,"TMNT (2007) is a Animation, Action, Adventure film directed by Kevin Munroe starring Patrick Stewart. Rated 6.2 on IMDB."
Never Back Down,2008,113,6.5,39.0,106137,"Action, Drama, Sport",Jeff Wadlow,Sean Faris,24.85,"Never Back Down (2008) is a Action, Drama, Sport film directed by Jeff Wadlow starring Sean Faris. Rated 6.5 on IMDB."
4: Rise of the Silver Surfer,2007,92,5.6,45.0,276780,"Action, Adventure, Fantasy",Tim Story,Ioan Gruffudd,131.92,"4: Rise of the Silver Surfer (2007) is a Action, Adventure, Fantasy film directed by Tim Story starring Ioan Gruffudd. Rated 5.6 on IMDB."
Nights in Rodanthe,2008,97,6.0,39.0,26294,"Drama, Romance",George C. Wolfe,Diane Lane,41.85,"Nights in Rodanthe (2008) is a Drama, Romance film directed by George C. Wolfe starring Diane Lane. Rated 6.0 on IMDB."
Blades of Glory,2007,93,6.3,64.0,177322,"Comedy, Sport",Josh Gordon,Will Speck,118.59,"Blades of Glory (2007) is a Comedy, Sport film directed by Josh Gordon starring Will Speck. Rated 6.3 on IMDB."
1408,2007,104,6.8,64.0,293135,"Fantasy, Horror, Mystery",Mikael Håfström,John Cusack,71.99,"1408 (2007) is a Fantasy, Horror, Mystery film directed by Mikael Håfström starring John Cusack. Rated 6.8 on IMDB."
